,number,value,datetime_start,datetime_complete,duration,params_batch_size,params_lr,params_momentum,params_optimiser,state
0,0,0.215,2023-05-28 09:45:14.770652,2023-05-28 10:25:15.196868,0 days 00:40:00.426216,128,0.3796211890359812,0.6109174519475442,sgd,COMPLETE
1,1,0.2849,2023-05-28 09:45:14.772039,2023-05-28 10:25:18.759785,0 days 00:40:03.987746,128,0.7871288439231868,0.6618203397509966,adadelta,COMPLETE
2,2,0.2138,2023-05-28 09:45:14.773220,2023-05-28 10:48:28.542288,0 days 01:03:13.769068,16,0.7498706521735123,0.8298185821309496,adagrad,COMPLETE
3,3,0.2818,2023-05-28 09:45:14.774725,2023-05-28 10:27:46.976734,0 days 00:42:32.202009,64,0.7754546597780156,0.7825676066359083,adadelta,COMPLETE
4,4,0.2069,2023-05-28 09:45:14.777687,2023-05-28 10:25:10.465094,0 days 00:39:55.687407,128,0.9019718015487274,0.7679423165867385,rmsprop,COMPLETE
5,5,0.2148,2023-05-28 09:45:14.778232,2023-05-28 10:25:17.727795,0 days 00:40:02.949563,128,0.1622660731326111,0.8651455830044783,rmsprop,COMPLETE
6,6,0.2817,2023-05-28 09:45:14.778725,2023-05-28 10:25:22.983853,0 days 00:40:08.205128,128,0.7072358274240228,0.6028498212902974,adadelta,COMPLETE
7,7,0.216,2023-05-28 09:45:14.778941,2023-05-28 10:27:46.275878,0 days 00:42:31.496937,64,0.8604263123163937,0.625143299026094,adamax,COMPLETE
8,8,0.1865,2023-05-28 09:45:14.779447,2023-05-28 10:48:38.059959,0 days 01:03:23.280512,16,0.6499138052245907,0.7732364557886233,rmsprop,COMPLETE
9,9,0.2402,2023-05-28 09:45:14.780099,2023-05-28 10:27:42.126940,0 days 00:42:27.346841,64,0.9574017846027494,0.6640303773650272,adagrad,COMPLETE
10,10,0.2898,2023-05-28 10:25:10.467686,2023-05-28 11:15:57.225153,0 days 00:50:46.757467,64,0.10240569219400175,0.8043146494880884,adadelta,COMPLETE
11,11,0.1953,2023-05-28 10:25:15.198167,2023-05-28 11:34:40.072358,0 days 01:09:24.874191,16,0.12907997621623513,0.801999627594897,adam,COMPLETE
12,12,0.2132,2023-05-28 10:25:17.730127,2023-05-28 11:16:01.093958,0 days 00:50:43.363831,64,0.08664254678737415,0.7526542865460829,rmsprop,COMPLETE
13,13,0.2136,2023-05-28 10:25:18.761937,2023-05-28 11:13:56.071452,0 days 00:48:37.309515,128,0.47783118706565975,0.6874668687971407,adamax,COMPLETE
14,14,0.2763,2023-05-28 10:25:22.988088,2023-05-28 11:13:47.459217,0 days 00:48:24.471129,128,0.7512323084633034,0.8965186458998768,adadelta,COMPLETE
15,15,0.2437,2023-05-28 10:27:42.128741,2023-05-28 11:18:41.080949,0 days 00:50:58.952208,64,0.566592992930213,0.6006402022403812,adagrad,COMPLETE
16,16,0.29,2023-05-28 10:27:46.280148,2023-05-28 11:26:06.428486,0 days 00:58:20.148338,32,0.4925115537463952,0.6003638122055379,adadelta,COMPLETE
17,17,0.2086,2023-05-28 10:27:46.978512,2023-05-28 11:26:00.122678,0 days 00:58:13.144166,32,0.6572218856568874,0.6863768561170234,adam,COMPLETE
18,18,0.211,2023-05-28 10:48:28.545857,2023-05-28 11:36:37.493464,0 days 00:48:08.947607,128,0.2869346487738451,0.661741654454779,adam,COMPLETE
19,19,0.2037,2023-05-28 10:48:38.063947,2023-05-28 11:46:03.779818,0 days 00:57:25.715871,32,0.4598706210567304,0.7081131074828693,adam,COMPLETE
20,20,0.1997,2023-05-28 11:13:47.462863,2023-05-28 12:06:05.999758,0 days 00:52:18.536895,32,0.4867203758693084,0.7015933115335862,adam,COMPLETE
21,21,0.2879,2023-05-28 11:13:56.074669,2023-05-28 12:06:23.648895,0 days 00:52:27.574226,32,0.5676893002649055,0.6993385600195158,adadelta,COMPLETE
22,22,0.2108,2023-05-28 11:15:57.227238,2023-05-28 12:07:59.188580,0 days 00:52:01.961342,32,0.034059230462875956,0.7112252806445261,adam,COMPLETE
23,23,0.1939,2023-05-28 11:16:01.096158,2023-05-28 12:08:02.196973,0 days 00:52:01.100815,32,0.27270373142999027,0.7168483944063835,adam,COMPLETE
24,24,0.2079,2023-05-28 11:18:41.083569,2023-05-28 12:10:22.248937,0 days 00:51:41.165368,32,0.2929176204570827,0.7041848551103902,adam,COMPLETE
25,25,0.2935,2023-05-28 11:26:00.127999,2023-05-28 12:17:09.713555,0 days 00:51:09.585556,32,0.2636881265128631,0.8300865092017877,adadelta,COMPLETE
26,26,0.2886,2023-05-28 11:26:06.432518,2023-05-28 12:17:17.913793,0 days 00:51:11.481275,32,0.28216687742142516,0.8087405238207834,adadelta,COMPLETE
27,27,0.297,2023-05-28 11:34:40.074075,2023-05-28 12:25:38.808853,0 days 00:50:58.734778,32,0.29590036064147696,0.7272683858687793,adadelta,COMPLETE
28,28,0.223,2023-05-28 11:36:37.495886,2023-05-28 12:27:28.881839,0 days 00:50:51.385953,32,0.009444731397235326,0.7316364979553656,adadelta,COMPLETE
29,29,0.2886,2023-05-28 11:46:03.781961,2023-05-28 12:35:59.534010,0 days 00:49:55.752049,32,0.27573014539066215,0.7173796610286041,adadelta,COMPLETE
30,30,0.2893,2023-05-28 12:06:06.001918,2023-05-28 12:53:59.683025,0 days 00:47:53.681107,32,0.24237979468966514,0.6477444084952492,adadelta,COMPLETE
31,31,0.2895,2023-05-28 12:06:23.650859,2023-05-28 12:54:17.083818,0 days 00:47:53.432959,32,0.2538022926283334,0.7228801787192815,adadelta,COMPLETE
32,32,0.2869,2023-05-28 12:07:59.191727,2023-05-28 12:55:35.863024,0 days 00:47:36.671297,32,0.2883455575309882,0.8169600926877946,adadelta,COMPLETE
33,33,0.2955,2023-05-28 12:08:02.198949,2023-05-28 12:55:41.730580,0 days 00:47:39.531631,32,0.3564241190908865,0.8248235981549529,adadelta,COMPLETE
34,34,0.2744,2023-05-28 12:10:22.251069,2023-05-28 12:57:45.434236,0 days 00:47:23.183167,32,0.5675648034747134,0.8189519223551064,adadelta,COMPLETE
35,35,0.29,2023-05-28 12:17:09.715370,2023-05-28 13:03:56.098512,0 days 00:46:46.383142,32,0.17322414788225965,0.8234343992572554,adadelta,COMPLETE
36,36,0.2988,2023-05-28 12:17:17.915484,2023-05-28 12:57:51.562896,0 days 00:40:33.647412,64,0.2007113710974815,0.8462795044841036,adadelta,COMPLETE
37,37,0.2101,2023-05-28 12:25:38.811278,2023-05-28 13:11:28.628553,0 days 00:45:49.817275,32,0.39695170708682637,0.8479607268944592,sgd,COMPLETE
38,38,0.205,2023-05-28 12:27:28.884533,2023-05-28 13:13:05.140843,0 days 00:45:36.256310,32,0.38248427121684414,0.8485361553447545,sgd,COMPLETE
39,39,0.2084,2023-05-28 12:35:59.536055,2023-05-28 13:21:06.057873,0 days 00:45:06.521818,32,0.38661603123423277,0.6291772594993539,sgd,COMPLETE
40,40,0.2308,2023-05-28 12:53:59.684912,2023-05-28 13:32:56.927889,0 days 00:38:57.242977,64,0.37707661830334394,0.8489634205753976,sgd,COMPLETE
41,41,0.2068,2023-05-28 12:54:17.085446,2023-05-28 13:33:11.168749,0 days 00:38:54.083303,64,0.3902688617288658,0.84218227159078,sgd,COMPLETE
42,42,0.225,2023-05-28 12:55:35.864379,2023-05-28 13:34:26.001494,0 days 00:38:50.137115,64,0.38675462864991617,0.855426314506575,sgd,COMPLETE
43,43,0.2872,2023-05-28 12:55:41.732991,2023-05-28 13:40:13.158149,0 days 00:44:31.425158,32,0.3798473318064723,0.8629836710158391,adadelta,COMPLETE
44,44,0.1892,2023-05-28 12:57:45.435987,2023-05-28 13:51:24.075507,0 days 00:53:38.639520,16,0.37463953860632915,0.8550063067112628,sgd,COMPLETE
45,45,0.1934,2023-05-28 12:57:51.565601,2023-05-28 13:51:34.335933,0 days 00:53:42.770332,16,0.407440832457169,0.856395639339752,sgd,COMPLETE
46,46,0.1921,2023-05-28 13:03:56.100465,2023-05-28 13:57:05.407272,0 days 00:53:09.306807,16,0.365280168645574,0.8517313280496085,sgd,COMPLETE
47,47,0.1863,2023-05-28 13:11:28.630562,2023-05-28 14:04:12.612035,0 days 00:52:43.981473,16,0.3690739076808943,0.8513199288020646,sgd,COMPLETE
48,48,0.1995,2023-05-28 13:13:05.142810,2023-05-28 14:05:45.729506,0 days 00:52:40.586696,16,0.34428831509240504,0.8770036262297708,sgd,COMPLETE
49,49,0.1884,2023-05-28 13:21:06.060317,2023-05-28 14:14:04.017452,0 days 00:52:57.957135,16,0.19070956282388057,0.8770263654243411,adamax,COMPLETE
50,50,0.2765,2023-05-28 13:32:56.929639,2023-05-28 14:27:09.788399,0 days 00:54:12.858760,16,0.1746418507892366,0.8789367583210077,adadelta,COMPLETE
51,51,0.2707,2023-05-28 13:33:11.171607,2023-05-28 14:27:34.395351,0 days 00:54:23.223744,16,0.19328307369857028,0.8844095215424522,adadelta,COMPLETE
52,52,0.2719,2023-05-28 13:34:26.003308,2023-05-28 14:28:51.664455,0 days 00:54:25.661147,16,0.20138779341318033,0.8788887104982899,adadelta,COMPLETE
53,53,0.2771,2023-05-28 13:40:13.160043,2023-05-28 14:35:41.217897,0 days 00:55:28.057854,16,0.19406515989634524,0.8873429449442131,adadelta,COMPLETE
54,54,0.1933,2023-05-28 13:51:24.078458,2023-05-28 14:48:18.845179,0 days 00:56:54.766721,16,0.1836934749710776,0.8876697094981735,adamax,COMPLETE
55,55,0.2175,2023-05-28 13:51:34.341489,2023-05-28 14:31:23.496531,0 days 00:39:49.155042,64,0.18861723645621872,0.8829698416893133,adamax,COMPLETE
56,56,0.2125,2023-05-28 13:57:05.409154,2023-05-28 14:37:58.811282,0 days 00:40:53.402128,64,0.19437614843865916,0.8783360373357025,adamax,COMPLETE
57,57,0.2058,2023-05-28 14:04:12.613942,2023-05-28 14:46:39.702773,0 days 00:42:27.088831,64,0.18727514410711,0.8843215529383812,adamax,COMPLETE
58,58,0.2186,2023-05-28 14:05:45.731878,2023-05-28 14:48:27.383431,0 days 00:42:41.651553,64,0.1903549533807941,0.7775951509961803,adamax,COMPLETE
59,59,0.2443,2023-05-28 14:14:04.022304,2023-05-28 14:57:37.703476,0 days 00:43:33.681172,64,0.1969424959134335,0.7868722984360859,adagrad,COMPLETE
60,60,0.2958,2023-05-28 14:27:09.793601,2023-05-28 15:16:12.756863,0 days 00:49:02.963262,32,0.20703504475036094,0.7778794636286771,adadelta,COMPLETE
61,61,0.2903,2023-05-28 14:27:34.397932,2023-05-28 15:16:34.413248,0 days 00:49:00.015316,32,0.12146243640226356,0.7895599874603143,adadelta,COMPLETE
62,62,0.2604,2023-05-28 14:28:51.667251,2023-05-28 15:17:26.746712,0 days 00:48:35.079461,32,0.14143894134575935,0.78875017262165,adagrad,COMPLETE
63,63,0.2482,2023-05-28 14:31:23.500024,2023-05-28 15:19:43.105223,0 days 00:48:19.605199,32,0.12547755978410097,0.7883835861240661,adagrad,COMPLETE
64,64,0.2558,2023-05-28 14:35:41.219769,2023-05-28 15:25:25.000703,0 days 00:49:43.780934,32,0.12723410729536838,0.7767434870701841,adagrad,COMPLETE
65,65,0.2667,2023-05-28 14:37:58.813128,2023-05-28 15:29:19.768831,0 days 00:51:20.955703,32,0.10019419614671868,0.7889481348047789,adagrad,COMPLETE
66,66,0.2513,2023-05-28 14:46:39.704921,2023-05-28 15:43:57.551935,0 days 00:57:17.847014,32,0.1295537953255795,0.7921515678300932,adagrad,COMPLETE
67,67,0.2248,2023-05-28 14:48:18.847830,2023-05-28 15:32:54.717691,0 days 00:44:35.869861,128,0.10559918551445945,0.7957372209322443,adagrad,COMPLETE
68,68,0.2127,2023-05-28 14:48:27.385513,2023-05-28 15:32:36.252593,0 days 00:44:08.867080,128,0.4394471887756048,0.7876286141899439,adagrad,COMPLETE
69,69,0.2216,2023-05-28 14:57:37.705686,2023-05-28 15:53:08.062515,0 days 00:55:30.356829,128,0.32518972271125235,0.8304650734079944,rmsprop,COMPLETE
70,70,0.2117,2023-05-28 15:16:12.758541,2023-05-28 16:32:20.233279,0 days 01:16:07.474738,32,0.12570188618050268,0.8321319774336472,rmsprop,COMPLETE
71,71,0.2123,2023-05-28 15:16:34.414916,2023-05-28 16:33:02.754651,0 days 01:16:28.339735,32,0.11583696474540939,0.7619708737030683,rmsprop,COMPLETE
72,72,0.225,2023-05-28 15:17:26.748879,2023-05-28 16:26:48.718421,0 days 01:09:21.969542,128,0.23068581755912565,0.7606498824435878,rmsprop,COMPLETE
73,73,0.2122,2023-05-28 15:19:43.106688,2023-05-28 16:34:23.740317,0 days 01:14:40.633629,128,0.08265486697482993,0.7587867858329259,rmsprop,COMPLETE
74,74,0.2075,2023-05-28 15:25:25.010196,2023-05-28 16:45:51.469311,0 days 01:20:26.459115,128,0.06390039626001096,0.7604928173640328,rmsprop,COMPLETE
75,75,0.215,2023-05-28 15:29:19.770317,2023-05-28 16:49:01.961875,0 days 01:19:42.191558,128,0.32272324093991667,0.7563223632209208,rmsprop,COMPLETE
76,76,0.2846,2023-05-28 15:32:36.256232,2023-05-28 16:56:57.230371,0 days 01:24:20.974139,32,0.06650448804661019,0.7582797305201814,adadelta,COMPLETE
77,77,0.2174,2023-05-28 15:32:54.719855,2023-05-28 16:56:58.656592,0 days 01:24:03.936737,32,0.06922447603717385,0.7542792961633095,rmsprop,COMPLETE
78,78,0.2032,2023-05-28 15:43:57.566216,2023-05-28 17:11:48.402005,0 days 01:27:50.835789,32,0.32650064016617625,0.7610269182009431,rmsprop,COMPLETE
79,79,0.2922,2023-05-28 15:53:08.068191,2023-05-28 17:16:30.037855,0 days 01:23:21.969664,32,0.23916510278049707,0.7575578400068813,adadelta,COMPLETE
80,80,0.2814,2023-05-28 16:26:48.719680,2023-05-28 17:53:44.405171,0 days 01:26:55.685491,32,0.06956941968192532,0.8339020897400992,adadelta,COMPLETE
81,81,0.2806,2023-05-28 16:32:20.237560,2023-05-28 18:05:53.526965,0 days 01:33:33.289405,32,0.06198605123317147,0.8099564739711362,adadelta,COMPLETE
82,82,0.3005,2023-05-28 16:33:02.756824,2023-05-28 18:05:53.623687,0 days 01:32:50.866863,32,0.30760919180555785,0.7384902798015964,adadelta,COMPLETE
83,83,0.2745,2023-05-28 16:34:23.744492,2023-05-28 18:09:12.842972,0 days 01:34:49.098480,32,0.05067460578556737,0.8158326629109433,adadelta,COMPLETE
84,84,0.2913,2023-05-28 16:45:51.472356,2023-05-28 18:14:04.197936,0 days 01:28:12.725580,32,0.2259446334126332,0.7460529921963108,adadelta,COMPLETE
85,85,0.2909,2023-05-28 16:49:01.971356,2023-05-28 18:24:18.980092,0 days 01:35:17.008736,32,0.23181690164598434,0.7420383212546598,adadelta,COMPLETE
86,86,0.2857,2023-05-28 16:56:57.233705,2023-05-28 18:28:16.362079,0 days 01:31:19.128374,32,0.5314013022748402,0.811313813118236,adadelta,COMPLETE
87,87,0.2874,2023-05-28 16:56:58.658393,2023-05-28 18:27:25.786099,0 days 01:30:27.127706,32,0.5270792132051516,0.8150820560725984,adadelta,COMPLETE
88,88,0.281,2023-05-28 17:11:48.427922,2023-05-28 18:42:02.738246,0 days 01:30:14.310324,32,0.510083885010723,0.8135697302705546,adadelta,COMPLETE
89,89,0.2921,2023-05-28 17:16:30.043252,2023-05-28 18:47:58.115228,0 days 01:31:28.071976,32,0.2327267288499137,0.7395599633753401,adadelta,COMPLETE
90,90,0.2969,2023-05-28 17:53:44.407198,2023-05-28 19:23:18.798014,0 days 01:29:34.390816,32,0.23220945595920428,0.7437174227708294,adadelta,COMPLETE
91,91,0.2941,2023-05-28 18:05:53.532235,2023-05-28 19:33:27.162152,0 days 01:27:33.629917,32,0.23579925421713133,0.739244012030376,adadelta,COMPLETE
92,92,0.2901,2023-05-28 18:05:53.624742,2023-05-28 19:36:48.769870,0 days 01:30:55.145128,32,0.2418734843453515,0.74019506579221,adadelta,COMPLETE
93,93,0.2939,2023-05-28 18:09:12.846049,2023-05-28 19:36:34.439677,0 days 01:27:21.593628,32,0.22298077463915164,0.7384560015682682,adadelta,COMPLETE
94,94,0.2927,2023-05-28 18:14:04.205257,2023-05-28 19:40:23.555206,0 days 01:26:19.349949,32,0.23617548972073138,0.742836542115531,adadelta,COMPLETE
95,95,0.2965,2023-05-28 18:24:18.981657,2023-05-28 19:48:30.130270,0 days 01:24:11.148613,32,0.23444224702726868,0.7420254132053494,adadelta,COMPLETE
96,96,0.2955,2023-05-28 18:27:25.790560,2023-05-28 19:50:13.150826,0 days 01:22:47.360266,32,0.23194965533167533,0.7400217538672559,adadelta,COMPLETE
97,97,0.2893,2023-05-28 18:28:16.364353,2023-05-28 19:50:42.932265,0 days 01:22:26.567912,32,0.2315452753893244,0.7417782648817709,adadelta,COMPLETE
98,98,0.2925,2023-05-28 18:42:02.742830,2023-05-28 19:59:01.486104,0 days 01:16:58.743274,32,0.2532961227707495,0.7394338516700697,adadelta,COMPLETE
99,99,0.2939,2023-05-28 18:47:58.119851,2023-05-28 20:02:21.673062,0 days 01:14:23.553211,32,0.25731851256532073,0.7337053915807513,adadelta,COMPLETE
